{"artifacts":[{"artifact_id":"frame-corpus-manifest","privacy_class":"hash_only","sha256":"11bcb481e3c683a44ce41e4dcef9ee98ad3172eea8f434c30f1b4d36e0464b91","size":195259},{"artifact_id":"frame-truth-1","privacy_class":"hash_only","sha256":"4c3de6ddb6c396601babf6df622f7901ab4ff9598271e83d7bf0095fd66860fc","size":1914},{"artifact_id":"frame-truth-2","privacy_class":"hash_only","sha256":"1c09b0cd940e6bfab1e289595f144e04e3191943216926a3f0adb23d6e802827","size":1879},{"artifact_id":"frame-truth-3","privacy_class":"hash_only","sha256":"440da8b59d788eaabb09d02c42b8c06793aea2e098a400d6f02b12def38ae025","size":1879},{"artifact_id":"frame-truth-4","privacy_class":"hash_only","sha256":"fdbe99f8a42a66bc5c98da3a51d9af208a302c81669d89ef2e8277fcab6a3914","size":1879},{"artifact_id":"frame-truth-5","privacy_class":"hash_only","sha256":"72a3f7fdc19c7ecd5686a0990ce09d7940960a40c9c1053a7cd02361a2227e5a","size":1879},{"artifact_id":"frame-truth-6","privacy_class":"hash_only","sha256":"bea26ea4cbda4a90857c86d44aa24dbb74e809c64db3ed70bed81aeb11df8ac3","size":1914},{"artifact_id":"frame-truth-7","privacy_class":"hash_only","sha256":"c67f2840b71379aad80edcfd7297996f2a6bfa26a427770c8f81ed06e3aec590","size":1877},{"artifact_id":"frame-truth-8","privacy_class":"hash_only","sha256":"7647c256f0d9c190348bab57df4446811f080a0a3d353eb01232975622e129db","size":1877},{"artifact_id":"frame-truth-9","privacy_class":"hash_only","sha256":"4d6b654ee424ff08335a3d470dc645a9a674d2486552fb3476f2631ebad25f28","size":1879},{"artifact_id":"frame-truth-10","privacy_class":"hash_only","sha256":"15dd6e3f6a65a7c428ec8cb3badf886374239bbfdc07493b986308ad2f6042ee","size":1879},{"artifact_id":"frame-truth-11","privacy_class":"hash_only","sha256":"783a244ddde0456d544577ab671f854c5c561be91ffaa38972311219516e28d5","size":1916},{"artifact_id":"frame-truth-12","privacy_class":"hash_only","sha256":"8a134eb9ff8534e5957580b318051a4efdea1402a0554fa91f7b5a2735869893","size":1879},{"artifact_id":"frame-truth-13","privacy_class":"hash_only","sha256":"669320b999aeef6612c23f589189c5df17154ab688277d400554e7c53de80eb4","size":1879},{"artifact_id":"frame-truth-14","privacy_class":"hash_only","sha256":"d759df5dd4677dbac3050dd9b3f82925739bdb6d6f4938b5c67c93733e279df2","size":1879},{"artifact_id":"frame-truth-15","privacy_class":"hash_only","sha256":"eca7b0816ca2a5734da067ac5e9767d9297d95a405447819ac4e75d24a152b22","size":1879},{"artifact_id":"frame-truth-16","privacy_class":"hash_only","sha256":"959f236f76b28755bd1174ea4ba438dd700e960e7aa8e009e8d4a3eb4c44d7c2","size":1916},{"artifact_id":"frame-truth-17","privacy_class":"hash_only","sha256":"47418369cf4fbd887ac097c3f2cfd62a24b2609632f811d08259f090800cc465","size":1879},{"artifact_id":"frame-truth-18","privacy_class":"hash_only","sha256":"9ce7b200a6c6972bff38e8804ec4eb1789249a8b3e187f87ac08c5ae27020379","size":1877},{"artifact_id":"frame-truth-19","privacy_class":"hash_only","sha256":"8c9e948d0e1f4f938c76639925e4c1e607f95bb39d9bd2ab6c3d56bd7060c4b6","size":1879},{"artifact_id":"frame-truth-20","privacy_class":"hash_only","sha256":"e4f5d7da3fe50061543c91bc0998da901181e406d5b86fcb7a2a4631b167e3fc","size":1879},{"artifact_id":"frame-truth-21","privacy_class":"hash_only","sha256":"0fbe4da0c33f7497423a9235ed23e4ea35e90a244b7b2068e87f394f479dc982","size":1916},{"artifact_id":"frame-truth-22","privacy_class":"hash_only","sha256":"e1ba30dd906491461748fc8996a1019dcd87aeddadaeb427a047fbecfce39741","size":1879},{"artifact_id":"frame-truth-23","privacy_class":"hash_only","sha256":"e319f7557b7c92261a9ab8429e595ddce395346e252bc4be4e9d119a0e0418df","size":1879},{"artifact_id":"frame-truth-24","privacy_class":"hash_only","sha256":"90bd5e8cd039c264e5813445c58775c63d79c08f4d440dec25a536f2bdef1ded","size":1879},{"artifact_id":"frame-truth-25","privacy_class":"hash_only","sha256":"e9473a236252353544d8eb02b282a11a7afe042911496d22269eb814277fef48","size":1879},{"artifact_id":"frame-truth-26","privacy_class":"hash_only","sha256":"ee5e690a87c3b6d4189d1bf5185c81990505e9a785965cdf2c0952ba48bf0183","size":1916},{"artifact_id":"frame-truth-27","privacy_class":"hash_only","sha256":"2f64383f63e5bde4e57c3321036f509c64248b62b3fe066c121da2cdf993f93b","size":1879},{"artifact_id":"frame-truth-28","privacy_class":"hash_only","sha256":"396ac2bd1f34438adda27a9846af1d96c9add5ab2254de521ceb8d8e09b2789f","size":1879},{"artifact_id":"frame-truth-29","privacy_class":"hash_only","sha256":"e1997d9cd0b125a847ee3d6a4ee4044289286b364345a7c7bdad88e4cf2949ed","size":1877},{"artifact_id":"frame-truth-30","privacy_class":"hash_only","sha256":"8e6cee614899714acc13a5ef952ca992a8ccd87ac4bea7598f8948f85c4604c7","size":1879},{"artifact_id":"frame-truth-31","privacy_class":"hash_only","sha256":"9df56c541e6b525dcf3fb7b09d0e9fe597d9aa919e08a06b28021df0f10e697b","size":1916},{"artifact_id":"frame-truth-32","privacy_class":"hash_only","sha256":"0c11bb96d741ce7ed391270e451fb97d8c066ceb707ed85711cd5322fbaea101","size":1879},{"artifact_id":"frame-truth-33","privacy_class":"hash_only","sha256":"f19b92ff9020aae2350525c42be9af3eb234116d258c06d81a5e2d766446895b","size":1879},{"artifact_id":"frame-truth-34","privacy_class":"hash_only","sha256":"c5272324dcabcc64f9db7b330f074bae88056cdea1ee9fb0b4d9d42af9a81733","size":1879},{"artifact_id":"frame-truth-35","privacy_class":"hash_only","sha256":"6d20c44f028d374c8aa2cd3534e2dabfbe9f17587a4e2a25207988d1af3109cf","size":1879},{"artifact_id":"frame-truth-36","privacy_class":"hash_only","sha256":"a8a1dab5b828487d2c11e2bb7af62855f3bbfd2c4f0b79c529b9131885ec1fc5","size":1916},{"artifact_id":"frame-truth-37","privacy_class":"hash_only","sha256":"e5e71e0d5fe46b18996fcb5e63811d48062a0de19c4293d82d9f753cc4eb944a","size":1879},{"artifact_id":"frame-truth-38","privacy_class":"hash_only","sha256":"289b249848f1e59fa12ba2950ff79a936b5f7cb151ef06a32a689076f4555b05","size":1879},{"artifact_id":"frame-truth-39","privacy_class":"hash_only","sha256":"abf069f976ced63082f160498b66fb6fa1d47bcdf8d3b30d11bdb0fe503076bd","size":1879},{"artifact_id":"frame-truth-40","privacy_class":"hash_only","sha256":"651f916e5bc53938561e72293d7f23c862d46341c83865a295cd450f3877d084","size":1879},{"artifact_id":"frame-truth-41","privacy_class":"hash_only","sha256":"b6e6a3b879af73296d307f2e82ab58ffbe40d0ccb0cd152a363f8501d25b1b40","size":1916},{"artifact_id":"frame-truth-42","privacy_class":"hash_only","sha256":"056eab42d6f79168b7db140c4a8470f6d44a4392fc6c34ce6977bfc0e2cda5fb","size":1879},{"artifact_id":"frame-truth-43","privacy_class":"hash_only","sha256":"95b77656841581f3c7994435af8068e342828d5823945381eb559b5f437de623","size":1879},{"artifact_id":"frame-truth-44","privacy_class":"hash_only","sha256":"987b081dd53668b8d320c77e07c87b9f7dd1a2f6da34e986d536bccae62201b0","size":1879},{"artifact_id":"frame-truth-45","privacy_class":"hash_only","sha256":"419a8e7e1e83f4ca947e355e8d90b90e310a7d4e6afade5c7dee3adc0f809f85","size":1879},{"artifact_id":"frame-truth-46","privacy_class":"hash_only","sha256":"e8f89d0003fec268ebd799cebef4d1df7b205e4ddf5800d223871bce5ec0e284","size":1916},{"artifact_id":"frame-truth-47","privacy_class":"hash_only","sha256":"7e47c8fbd39e2f4835c63aaab3f854dd454eedfbad350a9cba5877795eaa3de7","size":1879},{"artifact_id":"frame-truth-48","privacy_class":"hash_only","sha256":"dbceb22b9976b39a7418a6fc2dd6f0f51bb7e388303004b7eaf4af1b6f0319cf","size":1879},{"artifact_id":"frame-truth-49","privacy_class":"hash_only","sha256":"de123adab9fac66236bb33f0b5927c68a60b999a8ee41b8c82ee22a6f19589c3","size":1879},{"artifact_id":"frame-truth-50","privacy_class":"hash_only","sha256":"672932da20d76df3f51f491cd430a17c0ca280657dfbad85a9c90c1dfa6494b7","size":1879},{"artifact_id":"frame-truth-51","privacy_class":"hash_only","sha256":"9218a81dff7e512d130c50257feb1ac4a0181d4f86db4f35aba8b60afaaea0a4","size":1916},{"artifact_id":"frame-truth-52","privacy_class":"hash_only","sha256":"7054bb8812d2e2fcfe36f07200aabc9941237f89e195aaecebb1b99b0143c1c8","size":1879},{"artifact_id":"frame-truth-53","privacy_class":"hash_only","sha256":"cc773712847200b8e14ff980f4383b6d3d6a14b965418cc839093e14f1075a7f","size":1879},{"artifact_id":"frame-truth-54","privacy_class":"hash_only","sha256":"8cb7b879b5ab78ea68d3f570bffba4ddb4c484eb310378275409e559aca86d14","size":1879},{"artifact_id":"frame-truth-55","privacy_class":"hash_only","sha256":"ba89d9e130ce03c2dd8c72dbd58d9f95bd51416af6f8cbed9bbbc862f3308ec5","size":1879},{"artifact_id":"frame-truth-56","privacy_class":"hash_only","sha256":"0e44783b85c9cea5e01afcb9119467aee98870e668394e81bfd5345fce43389c","size":1916},{"artifact_id":"frame-truth-57","privacy_class":"hash_only","sha256":"a61a4b431fab18024af5a961a3192e4b05f1adf8a367b330fb80b59812d52c89","size":1879},{"artifact_id":"frame-truth-58","privacy_class":"hash_only","sha256":"74cc2591c1fd992ff479eb4ed9731830cb9ad5ea3d2f1e9b59887c4b524499c1","size":1879},{"artifact_id":"frame-truth-59","privacy_class":"hash_only","sha256":"80915eaf209ae293e3fafc78e451a9b830ad214048d18dfd295e251844845a29","size":1879},{"artifact_id":"frame-truth-60","privacy_class":"hash_only","sha256":"7ec5a2d58de367e93f15827d2da32e25a09163b8505d908e1933d81053a7f7c8","size":1879},{"artifact_id":"frame-truth-61","privacy_class":"hash_only","sha256":"2837a7eb109523dee67cecf566f34f4b9069d59dea32a2605dc5240cf0fb2ea0","size":1916},{"artifact_id":"frame-truth-62","privacy_class":"hash_only","sha256":"ec53406722ebd2a0fdf2ffc89a056555e8af8a4864c58b69e40d5bdb06aa0633","size":1879},{"artifact_id":"frame-truth-63","privacy_class":"hash_only","sha256":"441485dfac579456e16953220ad6fa107d4b94d236924d87db526461e26b219a","size":1879},{"artifact_id":"frame-truth-64","privacy_class":"hash_only","sha256":"97d6bda6036f611ddb2818066158e96bc1ee16a9e24f5aa0c87064637305d1a3","size":1879},{"artifact_id":"frame-truth-65","privacy_class":"hash_only","sha256":"deaa7662598704a1ef703a6b113e526f2069c683063e12b0a861c16b27b172af","size":1879},{"artifact_id":"frame-truth-66","privacy_class":"hash_only","sha256":"1d190f3af274b1992fee82b46661cacddaf7284c56ec57987df7ae1be0e831a6","size":1916},{"a